{
  "mandate_id": "mand-aether-001",
  "issuer": "user:jaden",
  "holder": "agent:buyer-1",
  "session_id": "sess-pay-1",
  "rail": "aether:aic",
  "asset": "AIC",
  "max_minor_units": 5000,
  "counterparty_policy": "prefix:aether:provider:",
  "purpose": "Pay an Aether-settled agent service invoice",
  "expires_at": "2026-07-10T00:00:00Z",
  "approval_threshold_minor_units": 2000,
  "idempotency_key": "mand-aether-001-key",
  "receipt_requirement": "required",
  "allowed_adapter_ids": ["aether"],
  "allowed_envelope_formats": ["aether-agent-payment-v1"]
}
